{
  "SchemaVersion": 1,
  "CapabilityCatalog": [
    {
      "CapabilityId": "git",
      "SupportedPlatforms": [
        "linux",
        "windows"
      ]
    },
    {
      "CapabilityId": "powershell-7.6",
      "SupportedPlatforms": [
        "linux",
        "windows"
      ]
    }
  ],
  "WindowsOnlyDependencyCatalog": [],
  "Cases": [
    {
      "Order": 1,
      "CaseId": "positive-bundled-start",
      "Group": "governance-record",
      "Tags": [
        "legacy-compatibility",
        "positive",
        "post-bl230-native"
      ],
      "SupportedPlatforms": [
        "linux",
        "windows"
      ],
      "RequiredCapabilities": [
        "git",
        "powershell-7.6"
      ],
      "WindowsOnlyDependency": []
    },
    {
      "Order": 2,
      "CaseId": "positive-current-state-gate",
      "Group": "governance-record",
      "Tags": [
        "current-state-gate",
        "positive",
        "post-bl230-native"
      ],
      "SupportedPlatforms": [
        "linux",
        "windows"
      ],
      "RequiredCapabilities": [
        "git",
        "powershell-7.6"
      ],
      "WindowsOnlyDependency": []
    },
    {
      "Order": 3,
      "CaseId": "positive-independent-review",
      "Group": "governance-record",
      "Tags": [
        "positive"
      ],
      "SupportedPlatforms": [
        "linux",
        "windows"
      ],
      "RequiredCapabilities": [
        "git",
        "powershell-7.6"
      ],
      "WindowsOnlyDependency": []
    },
    {
      "Order": 4,
      "CaseId": "positive-focused-delta",
      "Group": "governance-record",
      "Tags": [
        "positive"
      ],
      "SupportedPlatforms": [
        "linux",
        "windows"
      ],
      "RequiredCapabilities": [
        "git",
        "powershell-7.6"
      ],
      "WindowsOnlyDependency": []
    },
    {
      "Order": 5,
      "CaseId": "positive-commit-preparation",
      "Group": "governance-record",
      "Tags": [
        "positive"
      ],
      "SupportedPlatforms": [
        "windows"
      ],
      "RequiredCapabilities": [
        "git",
        "powershell-7.6"
      ],
      "WindowsOnlyDependency": []
    },
    {
      "Order": 6,
      "CaseId": "negative-required-current-state-gate-missing",
      "Group": "governance-record",
      "Tags": [
        "current-state-gate",
        "negative",
        "post-bl230-native"
      ],
      "SupportedPlatforms": [
        "linux",
        "windows"
      ],
      "RequiredCapabilities": [
        "git",
        "powershell-7.6"
      ],
      "WindowsOnlyDependency": []
    },
    {
      "Order": 7,
      "CaseId": "positive-release-hosted-ci",
      "Group": "governance-record",
      "Tags": [
        "positive"
      ],
      "SupportedPlatforms": [
        "linux",
        "windows"
      ],
      "RequiredCapabilities": [
        "git",
        "powershell-7.6"
      ],
      "WindowsOnlyDependency": []
    },
    {
      "Order": 8,
      "CaseId": "positive-real-filesystem-path",
      "Group": "governance-record",
      "Tags": [
        "positive"
      ],
      "SupportedPlatforms": [
        "linux",
        "windows"
      ],
      "RequiredCapabilities": [
        "git",
        "powershell-7.6"
      ],
      "WindowsOnlyDependency": []
    },
    {
      "Order": 9,
      "CaseId": "positive-real-mcp-path",
      "Group": "governance-record",
      "Tags": [
        "positive"
      ],
      "SupportedPlatforms": [
        "linux",
        "windows"
      ],
      "RequiredCapabilities": [
        "git",
        "powershell-7.6"
      ],
      "WindowsOnlyDependency": []
    },
    {
      "Order": 10,
      "CaseId": "positive-real-release-workflow-path",
      "Group": "governance-record",
      "Tags": [
        "positive"
      ],
      "SupportedPlatforms": [
        "linux",
        "windows"
      ],
      "RequiredCapabilities": [
        "git",
        "powershell-7.6"
      ],
      "WindowsOnlyDependency": []
    },
    {
      "Order": 11,
      "CaseId": "negative-missing-diff-trigger",
      "Group": "governance-record",
      "Tags": [
        "negative"
      ],
      "SupportedPlatforms": [
        "linux",
        "windows"
      ],
      "RequiredCapabilities": [
        "git",
        "powershell-7.6"
      ],
      "WindowsOnlyDependency": []
    },
    {
      "Order": 12,
      "CaseId": "negative-duplicate-search",
      "Group": "governance-record",
      "Tags": [
        "negative"
      ],
      "SupportedPlatforms": [
        "linux",
        "windows"
      ],
      "RequiredCapabilities": [
        "git",
        "powershell-7.6"
      ],
      "WindowsOnlyDependency": []
    },
    {
      "Order": 13,
      "CaseId": "negative-independent-mutation",
      "Group": "governance-record",
      "Tags": [
        "negative"
      ],
      "SupportedPlatforms": [
        "linux",
        "windows"
      ],
      "RequiredCapabilities": [
        "git",
        "powershell-7.6"
      ],
      "WindowsOnlyDependency": []
    },
    {
      "Order": 14,
      "CaseId": "negative-same-run-disposition",
      "Group": "governance-record",
      "Tags": [
        "negative"
      ],
      "SupportedPlatforms": [
        "linux",
        "windows"
      ],
      "RequiredCapabilities": [
        "git",
        "powershell-7.6"
      ],
      "WindowsOnlyDependency": []
    },
    {
      "Order": 15,
      "CaseId": "negative-deferred-without-boundary",
      "Group": "governance-record",
      "Tags": [
        "negative"
      ],
      "SupportedPlatforms": [
        "linux",
        "windows"
      ],
      "RequiredCapabilities": [
        "git",
        "powershell-7.6"
      ],
      "WindowsOnlyDependency": []
    },
    {
      "Order": 16,
      "CaseId": "negative-classic-readiness",
      "Group": "governance-record",
      "Tags": [
        "negative"
      ],
      "SupportedPlatforms": [
        "linux",
        "windows"
      ],
      "RequiredCapabilities": [
        "git",
        "powershell-7.6"
      ],
      "WindowsOnlyDependency": []
    },
    {
      "Order": 17,
      "CaseId": "negative-precommit-classic-readiness-false",
      "Group": "governance-record",
      "Tags": [
        "negative"
      ],
      "SupportedPlatforms": [
        "linux",
        "windows"
      ],
      "RequiredCapabilities": [
        "git",
        "powershell-7.6"
      ],
      "WindowsOnlyDependency": []
    },
    {
      "Order": 18,
      "CaseId": "negative-boundary-result",
      "Group": "governance-record",
      "Tags": [
        "negative"
      ],
      "SupportedPlatforms": [
        "linux",
        "windows"
      ],
      "RequiredCapabilities": [
        "git",
        "powershell-7.6"
      ],
      "WindowsOnlyDependency": []
    },
    {
      "Order": 19,
      "CaseId": "negative-open-precommit-finding",
      "Group": "governance-record",
      "Tags": [
        "negative"
      ],
      "SupportedPlatforms": [
        "linux",
        "windows"
      ],
      "RequiredCapabilities": [
        "git",
        "powershell-7.6"
      ],
      "WindowsOnlyDependency": []
    },
    {
      "Order": 20,
      "CaseId": "negative-release-ci-source",
      "Group": "governance-record",
      "Tags": [
        "negative"
      ],
      "SupportedPlatforms": [
        "linux",
        "windows"
      ],
      "RequiredCapabilities": [
        "git",
        "powershell-7.6"
      ],
      "WindowsOnlyDependency": []
    },
    {
      "Order": 21,
      "CaseId": "negative-release-ci-source-incomplete",
      "Group": "governance-record",
      "Tags": [
        "negative"
      ],
      "SupportedPlatforms": [
        "linux",
        "windows"
      ],
      "RequiredCapabilities": [
        "git",
        "powershell-7.6"
      ],
      "WindowsOnlyDependency": []
    },
    {
      "Order": 22,
      "CaseId": "negative-schema-boolean-type",
      "Group": "governance-record",
      "Tags": [
        "negative"
      ],
      "SupportedPlatforms": [
        "linux",
        "windows"
      ],
      "RequiredCapabilities": [
        "git",
        "powershell-7.6"
      ],
      "WindowsOnlyDependency": []
    },
    {
      "Order": 23,
      "CaseId": "negative-schema-nested-property",
      "Group": "governance-record",
      "Tags": [
        "negative"
      ],
      "SupportedPlatforms": [
        "linux",
        "windows"
      ],
      "RequiredCapabilities": [
        "git",
        "powershell-7.6"
      ],
      "WindowsOnlyDependency": []
    },
    {
      "Order": 24,
      "CaseId": "negative-path-parent-traversal",
      "Group": "governance-record",
      "Tags": [
        "negative"
      ],
      "SupportedPlatforms": [
        "linux",
        "windows"
      ],
      "RequiredCapabilities": [
        "git",
        "powershell-7.6"
      ],
      "WindowsOnlyDependency": []
    },
    {
      "Order": 25,
      "CaseId": "negative-path-absolute-unix",
      "Group": "governance-record",
      "Tags": [
        "negative"
      ],
      "SupportedPlatforms": [
        "linux",
        "windows"
      ],
      "RequiredCapabilities": [
        "git",
        "powershell-7.6"
      ],
      "WindowsOnlyDependency": []
    },
    {
      "Order": 26,
      "CaseId": "negative-path-absolute-windows",
      "Group": "governance-record",
      "Tags": [
        "negative"
      ],
      "SupportedPlatforms": [
        "linux",
        "windows"
      ],
      "RequiredCapabilities": [
        "git",
        "powershell-7.6"
      ],
      "WindowsOnlyDependency": []
    },
    {
      "Order": 27,
      "CaseId": "negative-path-unc",
      "Group": "governance-record",
      "Tags": [
        "negative"
      ],
      "SupportedPlatforms": [
        "linux",
        "windows"
      ],
      "RequiredCapabilities": [
        "git",
        "powershell-7.6"
      ],
      "WindowsOnlyDependency": []
    },
    {
      "Order": 28,